{
  "version": "0.1.0",

  "meta": {
    "title": "BPC 算法地图",
    "phase": "Phase 1: 基础 B&P",
    "project": "",
    "created": "2026-02-20",
    "updated": "2026-02-20"
  },

  "graph": {
    "nodes": [
      { "id": "start",                "label": "开始",           "type": "terminal" },
      { "id": "01_initialize",        "label": "1. 初始化",      "sub": "建模 + 初始列",    "type": "process" },
      { "id": "02_solve_rmp",         "label": "2. 求解 RMP",    "sub": "LP 松弛",          "type": "process" },
      { "id": "03_extract_duals",     "label": "3. 提取对偶 π",  "sub": "约束影子价格",     "type": "process" },
      { "id": "04_pricing",           "label": "4. 定价子问题",   "sub": "ESPPRC",           "type": "process" },
      { "id": "05_column_check",      "label": "负 RC 列?",      "type": "decision" },
      { "id": "06_integrality_check", "label": "整数解?",        "type": "decision" },
      { "id": "update_ub",            "label": "更新 UB",        "type": "auxiliary" },
      { "id": "07_bound_check",       "label": "LB ≥ UB?",      "sub": "剪枝判断",         "type": "decision" },
      { "id": "prune",                "label": "剪枝",           "type": "auxiliary" },
      { "id": "08_branch",            "label": "8. 分支",        "sub": "创建子节点",       "type": "process" },
      { "id": "queue_check",          "label": "队列空?",        "type": "auxiliary" },
      { "id": "select_next",          "label": "选下一节点",     "type": "auxiliary" },
      { "id": "09_terminate",         "label": "9. 输出结果",    "sub": "最优解",           "type": "terminal" }
    ],

    "edges": [
      { "from": "start",                "to": "01_initialize" },
      { "from": "01_initialize",        "to": "02_solve_rmp" },
      { "from": "02_solve_rmp",         "to": "03_extract_duals" },
      { "from": "03_extract_duals",     "to": "04_pricing" },
      { "from": "04_pricing",           "to": "05_column_check" },
      { "from": "05_column_check",      "to": "02_solve_rmp",          "label": "是（加入新列）" },
      { "from": "05_column_check",      "to": "06_integrality_check",  "label": "否（CG 收敛）" },
      { "from": "06_integrality_check", "to": "update_ub",             "label": "是" },
      { "from": "06_integrality_check", "to": "07_bound_check",        "label": "否" },
      { "from": "update_ub",            "to": "queue_check" },
      { "from": "07_bound_check",       "to": "prune",                 "label": "是" },
      { "from": "07_bound_check",       "to": "08_branch",             "label": "否" },
      { "from": "prune",                "to": "queue_check" },
      { "from": "08_branch",            "to": "queue_check" },
      { "from": "queue_check",          "to": "09_terminate",          "label": "是" },
      { "from": "queue_check",          "to": "select_next",           "label": "否" },
      { "from": "select_next",          "to": "02_solve_rmp" }
    ],

    "regions": [
      {
        "label": "Column Generation Loop",
        "nodes": ["02_solve_rmp", "03_extract_duals", "04_pricing", "05_column_check"]
      },
      {
        "label": "Branch-and-Bound",
        "nodes": ["02_solve_rmp", "03_extract_duals", "04_pricing", "05_column_check", "06_integrality_check", "update_ub", "07_bound_check", "prune", "08_branch"]
      }
    ]
  },

  "contents": {

    "01_initialize": {
      "title": "1. 初始化",
      "overview": "### 一句话\n\n读入实例数据，构造初始可行列（路径），建立限制主问题 RMP。\n\n### 输入 → 输出\n\n- **输入**：CVRP 实例文件（客户坐标、需求量 $q_i$、车辆容量 $Q$、距离矩阵 $c_{ij}$）\n- **输出**：RMP 模型（含初始列集合 $\\Omega'$）、初始上界 $UB = +\\infty$、B&B 队列（仅含根节点）\n\n### 为什么需要\n\nCVRP 的所有可行路径数量指数级增长，无法枚举。列生成的思想是：**从一个小的列子集出发，逐步按需生成有用的列**。初始化必须提供至少一组可行列，让 RMP 有可行解，列生成才能启动。\n\n没有初始列 → RMP 不可行 → 无法提取对偶值 → 列生成无法运转。\n\n### 数学模型 — 主问题 (MP)\n\n$$\\min \\sum_{r \\in \\Omega} c_r \\lambda_r$$\n\n$$\\text{s.t.} \\quad \\sum_{r \\in \\Omega} a_{ir} \\lambda_r \\geq 1 \\quad \\forall i \\in N \\quad \\text{（覆盖约束）}$$\n\n$$\\lambda_r \\in \\{0, 1\\} \\quad \\forall r \\in \\Omega$$\n\n**RMP** 是 MP 的松弛版本：只包含 $\\Omega' \\subset \\Omega$ 的子集列，且 $\\lambda$ 松弛为连续变量。",

      "how": "### 算法思路\n\n最简单的初始化策略：为每个客户生成一条独立路径（depot→客户→depot）。这些路径一定满足容量约束，保证 RMP 有可行解。虽然质量差（每辆车只服务一个客户），但列生成会逐步替换为更好的列。\n\n### 核心逻辑\n\n1. 解析实例文件，读取距离矩阵 `dist[n][n]`、需求量 `demand[n]`、容量 `Q`\n2. 对每个客户 i，创建路径 `[0, i, 0]`，费用 = `dist[0][i] + dist[i][0]`\n3. 将所有初始列加入 Gurobi 模型，建立覆盖约束（每个客户至少被一条路径覆盖）\n4. 初始化 B&B 队列，只含根节点；UB 设为 $+\\infty$\n\n### 设计决策\n\n- 距离计算用 `int()` 截断而非 `round()`，这是 CVRPLIB 的惯例，影响最优值对比\n- depot 编号为 0，客户编号从 1 开始\n- 单客户路径虽然质量差但保证可行，后续可改用最近邻启发式加速收敛",

      "verify": {
        "pre": [
          { "desc": "实例文件格式正确", "check": "文件能被解析，不报异常" },
          { "desc": "距离矩阵对称且非负", "check": "dist[i][j] == dist[j][i], dist[i][i] == 0" },
          { "desc": "所有客户需求 > 0 且 ≤ Q", "check": "0 < demand[i] ≤ capacity, demand[0] == 0" }
        ],
        "core": [
          { "desc": "初始列容量合法", "level": "L1", "method": "每条初始路径只含 1 个客户，需求必 ≤ Q", "cmd": "pytest test_rmp.py -k initial_columns -v" },
          { "desc": "初始列费用正确", "level": "L1", "method": "cost == dist[0][i] + dist[i][0]", "cmd": "pytest test_rmp.py -k cost -v" },
          { "desc": "RMP 有可行解", "level": "L1", "method": "初始列集合覆盖全部客户，model.optimize() 返回 OPTIMAL", "cmd": "pytest test_rmp.py -k feasible -v" },
          { "desc": "E-n13-k4 实例读取正确", "level": "L2", "method": "capacity=6000, n_customers=12，与 CVRPLIB 文档一致", "cmd": "pytest test_instance.py::test_explicit_instance_en13 -v" }
        ],
        "post": [
          { "desc": "RMP 模型可求解", "check": "model.status == GRB.OPTIMAL" },
          { "desc": "列数 = 客户数", "check": "len(columns) == n_customers" },
          { "desc": "覆盖矩阵每行至少一个 1", "check": "对每个客户 i，至少一条列包含 i" },
          { "desc": "UB == +∞, queue 含一个根节点", "check": "初始状态正确" }
        ]
      },

      "code": {
        "files": ["src/python/bpc/rmp.py", "src/cpp/rmp.cpp"],
        "snippet": "```python\nclass RMP:\n    def __init__(self, instance):\n        self.model = gp.Model(\"RMP\")\n        self.model.setParam('OutputFlag', 0)\n        self.columns = []\n        self.cover_constrs = []\n        self._add_initial_columns(instance)\n\n    def _add_initial_columns(self, inst):\n        for i in range(1, inst.n):\n            cost = inst.dist[0][i] + inst.dist[i][0]\n            col = Column(cost=cost, visits=[i], path=[0, i, 0])\n            self.add_column(col)\n```"
      },

      "refs": "### 关键参考\n\n- **CVRPLIB**：[标准测试实例库](http://vrp.atd-lab.inf.puc-rio.br/index.php/en/)，提供实例文件和已知最优解\n- **距离取整规则**：TSPLIB 文档规定 EUC_2D 距离用 `int()` 截断，不是 `round()`",

      "pitfalls": ""
    },

    "02_solve_rmp": {
      "title": "2. 求解 RMP",
      "overview": "### 一句话\n\n求解当前限制主问题的 LP 松弛，得到目标函数值（下界 LB）和决策变量 $\\lambda$ 的值。\n\n### 输入 → 输出\n\n- **输入**：当前 RMP 模型（含已有列集合）\n- **输出**：LB（LP 最优值）、$\\lambda$ 值向量、模型状态\n\n### 为什么需要\n\nRMP 的 LP 松弛解提供当前 B&B 节点的下界。这个下界用于剪枝判断（$LB \\geq UB$ 则剪枝）。同时 LP 解的对偶值将指导子问题寻找新列。",

      "how": "### 算法思路\n\n直接调用 Gurobi 求解 LP 松弛。RMP 是一个标准的集合覆盖型 LP，Gurobi 通常在毫秒级完成。\n\n### 核心逻辑\n\n1. 调用 `model.optimize()`\n2. 检查求解状态，确保是 OPTIMAL\n3. 读取目标函数值作为 LB\n4. 读取各列对应的 $\\lambda$ 变量值\n\n### 设计决策\n\n- 必须设置 `model.setParam('DualReductions', 0)`，否则 Gurobi 可能跳过对偶值计算\n- LP 松弛的 $\\lambda$ 是连续变量 $[0,1]$，不是整数",

      "verify": {
        "pre": [
          { "desc": "RMP 模型已正确构建", "check": "model 包含覆盖约束和列变量" },
          { "desc": "至少有一组可行列", "check": "列集合覆盖所有客户" }
        ],
        "core": [
          { "desc": "T3 实例全路线 LP 最优值 = 20.0", "level": "L1", "method": "手工构造 3 客户实例，传入所有 5 条可行路线", "cmd": "pytest test_rmp.py::test_lp_optimal_value_all_routes -v" },
          { "desc": "所有 λ ≥ 0", "level": "L1", "method": "断言每个变量值非负", "cmd": "pytest test_rmp.py::test_lambda_nonneg -v" }
        ],
        "post": [
          { "desc": "LB 是有效下界", "check": "LB ≤ 真实最优值" },
          { "desc": "模型状态为 OPTIMAL", "check": "model.status == GRB.OPTIMAL" },
          { "desc": "可提取对偶值", "check": "cover_constrs[i].Pi 可访问且非零" }
        ]
      },

      "code": {
        "files": ["src/python/bpc/rmp.py"],
        "snippet": "```python\ndef solve(self):\n    self.model.optimize()\n    if self.model.status != GRB.OPTIMAL:\n        raise RuntimeError(f\"RMP not optimal: {self.model.status}\")\n    return self.model.objVal\n\ndef get_lambdas(self):\n    return {col: col.var.X for col in self.columns}\n```"
      },

      "refs": "### 关键参考\n\n- **Gurobi 文档**：LP 求解参数配置，特别是 DualReductions 参数",
      "pitfalls": ""
    },

    "03_extract_duals": {
      "title": "3. 提取对偶 π",
      "overview": "### 一句话\n\n从 RMP 最优解中提取每个覆盖约束的对偶值 $\\pi_i$（影子价格），传给定价子问题。\n\n### 输入 → 输出\n\n- **输入**：已求解的 RMP 模型\n- **输出**：对偶值向量 $\\pi = [\\pi_1, \\ldots, \\pi_n]$\n\n### 为什么需要\n\n对偶值 $\\pi_i$ 反映了「服务客户 i 对目标函数的边际贡献」。子问题利用这些值计算 reduced cost，判断哪些新列值得生成。没有对偶值，子问题就不知道该找什么样的列。",

      "how": "### 算法思路\n\n直接读取 Gurobi 约束对象的 `.Pi` 属性。每个覆盖约束对应一个客户，其对偶值就是该客户的 $\\pi$。\n\n### 核心逻辑\n\n1. 遍历 RMP 的覆盖约束列表\n2. 读取每个约束的 `.Pi` 值\n3. 组装为 $\\pi$ 向量返回\n\n### 设计决策\n\n- 覆盖约束是 $\\geq$ 约束，对偶值应 $\\geq 0$（互补松弛条件）\n- 如果对偶值全为 0，检查是否设置了 `DualReductions=0`",

      "verify": {
        "pre": [
          { "desc": "RMP 已求解且状态为 OPTIMAL", "check": "model.status == GRB.OPTIMAL" },
          { "desc": "DualReductions 已关闭", "check": "model.getParamInfo('DualReductions') == 0" }
        ],
        "core": [
          { "desc": "对偶值维度正确", "level": "L1", "method": "len(π) == n_customers", "cmd": "pytest test_duals.py -v" },
          { "desc": "对偶值非负", "level": "L1", "method": "所有 π[i] ≥ 0", "cmd": "pytest test_duals.py::test_nonneg -v" },
          { "desc": "T3 实例对偶值与手算一致", "level": "L2", "method": "手算 3 客户实例的对偶解，比对", "cmd": "pytest test_duals.py::test_t3_duals -v" }
        ],
        "post": [
          { "desc": "π 向量长度 = 客户数", "check": "len(π) == n_customers" },
          { "desc": "所有 π ≥ 0", "check": "min(π) ≥ 0" }
        ]
      },

      "code": {
        "files": ["src/python/bpc/rmp.py"],
        "snippet": "```python\ndef get_duals(self):\n    return [c.Pi for c in self.cover_constrs]\n```"
      },

      "refs": "",
      "pitfalls": ""
    },

    "04_pricing": {